<?xml version="1.0" encoding="UTF-8"?>
<emilia xmlns:xsi="http://www.w3.org/2001/XMLSchema-instance"
	xsi:noNamespaceSchemaLocation="emilia.xsd">

	<eventClassifierClass>emilia.defaultImpl.modules.classifier.EventClassifier</eventClassifierClass>
	<normRecognitionClass>emilia.defaultImpl.modules.recognition.NormRecognitionController</normRecognitionClass>
	<normAdoptionClass>emilia.defaultImpl.modules.adoption.NormAdoptionController</normAdoptionClass>
	<normSalienceClass>emilia.defaultImpl.modules.salience.NormSalienceController</normSalienceClass>
	<normEnforcementClass>emilia.defaultImpl.modules.enforcement.NormEnforcementController</normEnforcementClass>
	<normComplianceClass>emilia.defaultImpl.modules.compliance.NormComplianceController</normComplianceClass>
	<normativeBoardClass>emilia.defaultImpl.board.NormativeBoard</normativeBoardClass>
</emilia>