<?xml version="1.0" encoding="UTF-8"?>
<emilia xmlns:xsi="http://www.w3.org/2001/XMLSchema-instance"
	xsi:noNamespaceSchemaLocation="emilia.xsd">

	<eventClassifierClass>examples.topology.modules.classifier.EventClassifier</eventClassifierClass>
	<normRecognitionClass>examples.topology.modules.recognition.NormRecognitionController</normRecognitionClass>
	<normAdoptionClass>examples.topology.modules.adoption.NormAdoptionController</normAdoptionClass>
	<normSalienceClass>examples.topology.modules.salience.NormSalienceController</normSalienceClass>
	<normEnforcementClass>examples.topology.modules.enforcement.NormEnforcementController</normEnforcementClass>
	<normComplianceClass>examples.topology.modules.compliance.NormComplianceController</normComplianceClass>
	<normativeBoardClass>examples.topology.board.NormativeBoard</normativeBoardClass>
</emilia>